{
  "$schema": "http://json-schema.org/draft-07/schema#",
  "$id": "brief.schema.json",
  "title": "Episode Brief",
  "description": "Artifact chốt ở Gate 1. Khoảng số đối chiếu với format-spec.json mục limits.",
  "type": "object",
  "additionalProperties": false,
  "required": [
    "episodeId",
    "channel",
    "topic",
    "thesis",
    "thesisId",
    "thesisArchetype",
    "pillar",
    "audience",
    "targetDurationMin",
    "proposedBy",
    "approvedBy",
    "workingTitle",
    "noveltyCheck",
    "versions"
  ],
  "properties": {
    "episodeId": {
      "type": "string",
      "pattern": "^[a-z0-9-]+/[0-9]{4}-[0-9]{2}-[a-z0-9-]+$"
    },
    "channel": {
      "type": "string",
      "pattern": "^[a-z0-9-]+$"
    },
    "topic": {
      "type": "string",
      "minLength": 10,
      "maxLength": 200
    },
    "thesis": {
      "type": "string",
      "minLength": 40,
      "maxLength": 500
    },
    "thesisId": {
      "type": "string",
      "pattern": "^[a-z0-9-]+/TB-[0-9]{3}$"
    },
    "thesisArchetype": {
      "type": "string",
      "description": "Hằng số nội dung. Validator đối chiếu format-spec.thesisArchetypes."
    },
    "pillar": {
      "type": "string",
      "description": "Hằng số nội dung. Validator đối chiếu channel.pillars."
    },
    "audience": {
      "type": "object",
      "additionalProperties": false,
      "required": [
        "ageRange",
        "decisionContext",
        "priorBelief"
      ],
      "properties": {
        "ageRange": {
          "type": "string"
        },
        "decisionContext": {
          "type": "string",
          "minLength": 15
        },
        "priorBelief": {
          "type": "string",
          "minLength": 15
        }
      }
    },
    "geoScope": {
      "type": "string",
      "description": "'national', 'states:XX,YY', hoặc 'varies'. Bắt buộc nếu tập có ma trận ngưỡng."
    },
    "targetDurationMin": {
      "type": "number",
      "exclusiveMinimum": 0,
      "description": "Validator đối chiếu format-spec.limits.targetDurationMin."
    },
    "formatVariant": {
      "type": "string",
      "description": "Chiều đang thử trong thiết kế thí nghiệm khối hiện tại. Rỗng nếu thuộc nhóm chuẩn."
    },
    "proposedBy": {
      "type": "string",
      "enum": [
        "machine",
        "human"
      ]
    },
    "approvedBy": {
      "type": "string",
      "enum": [
        "human",
        "machine-tier2"
      ],
      "description": "Gate 1 KHÔNG BAO GIỜ bị bỏ. Ai xác nhận thì phụ thuộc bậc của gate1-topic-selection trong automation-tiers.json — maxTier của nó là 2, nên machine-tier3 không hợp lệ cho brief."
    },
    "approvedAt": {
      "type": "string",
      "format": "date-time"
    },
    "steerNote": {
      "type": "string",
      "maxLength": 300
    },
    "workingTitle": {
      "type": "string",
      "maxLength": 100
    },
    "noveltyCheck": {
      "type": "object",
      "additionalProperties": false,
      "required": [
        "videosChecked",
        "contradictingVideos",
        "verdict",
        "checkedBy"
      ],
      "properties": {
        "videosChecked": {
          "type": "integer",
          "minimum": 0
        },
        "contradictingVideos": {
          "type": "integer",
          "minimum": 0,
          "description": "Số video trong corpus nói ngược với thesis. Bằng 0 là HỢP LỆ và thường là dấu hiệu mới lạ cao — không phải lỗi. Tên khác với thesis.contradicts để không lẫn: bên kia là chuỗi mô tả niềm tin bị thách thức."
        },
        "verdict": {
          "type": "string",
          "enum": [
            "novel",
            "incremental",
            "duplicate"
          ]
        },
        "checkedBy": {
          "type": "string",
          "enum": [
            "machine"
          ]
        },
        "corpusSnapshot": {
          "type": "string",
          "format": "date"
        }
      }
    },
    "sensitivityPreview": {
      "type": "object",
      "additionalProperties": false,
      "properties": {
        "modelId": {
          "type": "string",
          "pattern": "^[a-z0-9-]+/M-[0-9]{3}$"
        },
        "flipFound": {
          "type": "boolean"
        },
        "flipDescription": {
          "type": "string",
          "maxLength": 300
        }
      }
    },
    "rpmTier": {
      "type": "string",
      "enum": [
        "high",
        "medium",
        "low"
      ]
    },
    "versions": {
      "type": "object",
      "additionalProperties": false,
      "required": [
        "engine",
        "genre",
        "channel"
      ],
      "properties": {
        "engine": {
          "type": "string"
        },
        "genre": {
          "type": "string"
        },
        "channel": {
          "type": "string"
        }
      }
    }
  }
}
