{"episodeId":"us-personal-finance/2026-09-fs24-right","channel":"us-personal-finance","topic":"FS24 synthetic integration fixture","thesis":"FS24 synthetic test fixture; no production claim or publication approval is represented.","thesisId":"data-explainer/TB-001","thesisArchetype":"threshold-inversion","pillar":"housing","audience":{"ageRange":"fixture","decisionContext":"Synthetic test context only","priorBelief":"Synthetic test assumption only"},"targetDurationMin":18,"proposedBy":"machine","approvedBy":"human","workingTitle":"FS24 synthetic fixture","noveltyCheck":{"videosChecked":5,"contradictingVideos":0,"verdict":"novel","checkedBy":"machine"},"versions":{"engine":"1.0@git-commit:bd7f0eb5b225ed43d610af12b5febbe82a7dbec4","genre":"1.1@git-tree:ef5389474fc79ed30482f5771076f1e3c3b2ba31","channel":"git-tree:52d17deb20a9ac2c948a0e45ac8b0a9cc7aca8a3"}}
